{
 "@context": [
  "https://foundry.lakatos.example/schema/context.v0.jsonld",
  {
   "rd": "https://foundry.lakatos.example/theory/resource-dependence#"
  }
 ],
 "@id": "rd:reading1",
 "@type": "TheoryObject",
 "schemaVersion": "0.1-draft",
 "label": "Resource-dependence theory of organizational boundaries, Reading 1 (decomposition reading)",
 "tradition": "resource-dependence theory",
 "readingOf": "rd:ensemble",
 "sources": [
  {
   "citation": "Foundry demonstration case inputs, Input B (paraphrase after Pfeffer & Salancik 1978; Casciaro & Piskorski 2005)",
   "span": "B.1-B.9"
  }
 ],
 "stanceProfile": {
  "epistemologicalStance": "positivism-lay",
  "corroborationLogic": "inductivism-frequentist",
  "ontologicalCommitments": [
   "organizations as actors with interests",
   "external actors that control resources",
   "dependence and power as directed dyadic relations",
   "managers with goals (uncertainty reduction, autonomy)",
   "inter-organizational ties (mergers, interlocks, joint ventures, contracts)",
   "organizational boundaries"
  ],
  "modelClasses": [
   "relational",
   "causal",
   "teleological"
  ],
  "explanatoryNorms": [
   "coverage-parsimony"
  ],
  "justificationStrategies": [
   "eliminative"
  ],
  "inferenceNorms": [
   "abductive",
   "deductive"
  ],
  "evidence": "positivism-lay: B.9 'Empirically, we should observe' states observable regularities without a measurement theory. inductivism-frequentist (tentative): predictions are distributional tendencies ('most likely' B.6, 'concentrate' B.9) and no refutation condition is stated. relational: the main constructs are dyadic relations (B.2, B.3, B.6, B.7). teleological: managers 'act to manage dependence' (B.4). causal: 'makes absorption feasible' (B.6), 'leaves it less able' (B.7). coverage-parsimony: one principle (dependence management) accounts for four tactics (B.5) and for boundaries (B.8). eliminative: 'rather than the minimization of costs' (B.8) sets the account against a cost-based rival. abductive with deductive language: 'therefore' (B.8) presents an inference to the best explanation as if it followed from B.1-B.7 (see rd:D1)."
 },
 "scopeConditions": [
  {
   "@id": "rd:S1",
   "statement": "Organizations that need critical resources controlled by other actors in their environment.",
   "explicitness": "explicit"
  },
  {
   "@id": "rd:S2",
   "statement": "The unit is the directed dyad between a focal organization and a supplier or buyer; dependence is assessed dyad by dyad.",
   "explicitness": "explicit"
  },
  {
   "@id": "rd:S3",
   "statement": "Managers have enough discretion to choose and carry out a tactic.",
   "explicitness": "implicit"
  },
  {
   "@id": "rd:S4",
   "statement": "Merger and acquisition are legally and financially open to the dyad (no regulatory bar, transferable ownership). Without this, rd:P4-rd:P7 do not apply; rd:P1-rd:P3 still apply to organizations of any legal form.",
   "explicitness": "surfaced"
  }
 ],
 "constructs": [
  {
   "@id": "rd:C1",
   "label": "Resource dependence (of A on B)",
   "definition": "The extent to which focal organization A relies on actor B for a resource A needs; greater the more important the resource and the fewer the alternative sources (B.2, B.3).",
   "constructType": "relation",
   "level": "dyad",
   "measurementCommitments": [
    {
     "indicator": "uncommitted",
     "unitOfAnalysis": "directed dyad: focal organization and a supplier or buyer (B.3)"
    }
   ],
   "inferentialRole": {
    "commitments": [
     {
      "@id": "rd:C1.c1",
      "statement": "If A depends on B, then B controls a resource A uses in its operations.",
      "refs": [
       "rd:A1"
      ],
      "strength": "strict"
     },
     {
      "@id": "rd:C1.c2",
      "statement": "If A depends heavily on B, then A's operations would suffer if B withheld the resource, because A could not quickly replace it.",
      "strength": "defeasible"
     }
    ],
    "entitlements": [
     {
      "@id": "rd:C1.e1",
      "statement": "If B's resource is important to A's operations and A has few alternative sources, one is entitled to assert that A depends heavily on B.",
      "refs": [
       "rd:C2",
       "rd:C3",
       "rd:P1"
      ],
      "strength": "strict"
     }
    ],
    "licenses": [
     {
      "@id": "rd:C1.l1",
      "statement": "If A depends on B to degree d, infer that B has power over A to degree d.",
      "refs": [
       "rd:C4",
       "rd:P2"
      ],
      "strength": "strict"
     },
     {
      "@id": "rd:C1.l2",
      "statement": "If A depends heavily on B, infer that A's managers will take some tactic aimed at B.",
      "refs": [
       "rd:C11",
       "rd:A3"
      ],
      "strength": "defeasible"
     }
    ],
    "precludes": [
     {
      "@id": "rd:C1.p1",
      "statement": "A depends heavily on B although the resource is peripheral to A and many equivalent sources exist.",
      "refs": [
       "rd:P1"
      ],
      "strength": "strict"
     }
    ]
   }
  },
  {
   "@id": "rd:C2",
   "label": "Resource importance",
   "definition": "How important the resource is to the organization's operations (B.3).",
   "constructType": "attribute",
   "level": "dyad",
   "measurementCommitments": [
    {
     "indicator": "uncommitted",
     "unitOfAnalysis": "resource flow within a dyad"
    }
   ],
   "inferentialRole": {
    "commitments": [
     {
      "@id": "rd:C2.c1",
      "statement": "If a resource is important to A, then losing it would substantially disrupt A's operations.",
      "strength": "defeasible"
     }
    ],
    "entitlements": [
     {
      "@id": "rd:C2.e1",
      "statement": "If A's operations would fall substantially if the resource were withdrawn, one is entitled to assert high importance (inferred criterion; the text names none).",
      "strength": "defeasible"
     }
    ],
    "licenses": [
     {
      "@id": "rd:C2.l1",
      "statement": "If importance rises and alternatives stay the same, infer that A's dependence on the supplier rises.",
      "refs": [
       "rd:R1",
       "rd:P1"
      ],
      "strength": "strict"
     }
    ],
    "precludes": [
     {
      "@id": "rd:C2.p1",
      "statement": "A resource is highly important to A, yet losing it leaves A's operations unaffected.",
      "strength": "strict"
     }
    ]
   }
  },
  {
   "@id": "rd:C3",
   "label": "Availability of alternative sources",
   "definition": "The number of sources other than B from which A could obtain the resource (or, for a buyer, to which A could sell) (B.3).",
   "constructType": "attribute",
   "level": "dyad",
   "measurementCommitments": [
    {
     "indicator": "uncommitted (the text implies a count of alternative suppliers or buyers but gives no indicator)",
     "unitOfAnalysis": "directed dyad"
    }
   ],
   "inferentialRole": {
    "commitments": [
     {
      "@id": "rd:C3.c1",
      "statement": "If A has alternative sources, then A could obtain the resource from actors other than B on terms not much worse (the 'comparable terms' qualifier is inferred).",
      "strength": "defeasible"
     }
    ],
    "entitlements": [
     {
      "@id": "rd:C3.e1",
      "statement": "If several other actors can supply the resource to A or buy A's output, one is entitled to assert that alternatives are available.",
      "strength": "defeasible"
     }
    ],
    "licenses": [
     {
      "@id": "rd:C3.l1",
      "statement": "If alternatives fall and importance stays the same, infer that A's dependence on B rises.",
      "refs": [
       "rd:R2",
       "rd:P1"
      ],
      "strength": "strict"
     },
     {
      "@id": "rd:C3.l2",
      "statement": "If A gains alternatives, infer that B's power over A falls.",
      "refs": [
       "rd:C4"
      ],
      "strength": "strict"
     }
    ],
    "precludes": [
     {
      "@id": "rd:C3.p1",
      "statement": "A has many ready alternatives, yet B can withhold the resource and A suffers as if B were the only source.",
      "strength": "strict"
     }
    ]
   }
  },
  {
   "@id": "rd:C4",
   "label": "Power (of B over A)",
   "definition": "Other actors' power over the organization, which the organization's dependence on them gives rise to (B.2).",
   "constructType": "relation",
   "level": "dyad",
   "measurementCommitments": [
    {
     "indicator": "uncommitted (in Reading 1, measured through rd:C1; no separate indicator)",
     "unitOfAnalysis": "directed dyad"
    }
   ],
   "inferentialRole": {
    "commitments": [
     {
      "@id": "rd:C4.c1",
      "statement": "If B has power over A, then B can restrict A's choices or press demands that A would otherwise refuse (inferred; the text does not say what power does).",
      "strength": "defeasible"
     }
    ],
    "entitlements": [
     {
      "@id": "rd:C4.e1",
      "statement": "If A depends on B to degree d, one is entitled to assert that B has power over A to degree d, with no further evidence needed.",
      "refs": [
       "rd:C1",
       "rd:A2"
      ],
      "strength": "strict"
     }
    ],
    "licenses": [
     {
      "@id": "rd:C4.l1",
      "statement": "If B has power over A, infer that A's autonomy is lower than it would otherwise be.",
      "refs": [
       "rd:C10",
       "rd:R4"
      ],
      "strength": "defeasible"
     },
     {
      "@id": "rd:C4.l2",
      "statement": "If both sides' power is known, infer which tactic A will choose toward B.",
      "refs": [
       "rd:C11",
       "rd:P4",
       "rd:P5",
       "rd:P6"
      ],
      "strength": "defeasible"
     }
    ],
    "precludes": [
     {
      "@id": "rd:C4.p1",
      "statement": "B has power over A although A depends on B for nothing.",
      "refs": [
       "rd:A2"
      ],
      "strength": "strict"
     }
    ]
   },
   "alternativeRoles": [
    {
     "readingLabel": "Reading 3: power caused by, not constituted by, dependence",
     "commitments": [
      {
       "@id": "rd:C4.r3c1",